{
  "format": "ai-cockpit-task-outcome",
  "schemaVersion": 1,
  "workItemId": "governance-performance-budget",
  "status": "completed",
  "bindings": {
    "taskId": "governance-performance-budget",
    "contractDigest": "d9dd572e09baa13848e5af481164fd102f8316932ab0bb95802e09c4f80f6faf",
    "summaryDigest": "d5a01437f3e08602ba62d215b849770441be0f87f531dc7aa5f8e961a749f793",
    "verificationDigest": "572f0d28f538ea7e03ee056ec0967d380e4f5ed5ae0990ce791ee963de312de1",
    "baseCommit": "cbdc0775dd4de84727a8c752232667928de516ff",
    "headCommit": "cbdc0775dd4de84727a8c752232667928de516ff",
    "lifecycleStage": "pre_merge",
    "pullRequest": {
      "state": "not_created"
    },
    "aiCockpitVersion": "repository-governance",
    "generatorVersion": "1.0"
  },
  "sections": {
    "outcomeSummary": "Task governance-performance-budget generated an evidence-derived outcome with status completed.",
    "taskOverview": "Governed Work Item: governance-performance-budget",
    "deliveredChanges": [
      ".ai/work-items/archive/2026/governance-performance-budget.contract.json",
      ".ai/work-items/archive/2026/governance-performance-budget.summary.json",
      "scripts/summarize_quality_gates.py",
      "scripts/ai_performance_budget.py",
      "Makefile",
      ".github/workflows/smoke.yml",
      "tests/test_quality_telemetry.py",
      "tests/test_performance_budget.py",
      "tests/test_makefile.py",
      "tests/test_ci_quality_orchestration.py",
      "docs/reference/governance-performance-budget.md",
      "docs/reference/capability-truth-matrix.json",
      "docs/reference/japanese-capability-assessment.json",
      "docs/reference/japanese-capability-assessment.md",
      "docs/reference/pre-release-documentation-alignment.json",
      "docs/reference/pre-release-documentation-alignment.md",
      ".ai/work-items/archive/2026/governance-performance-budget.outcome.json",
      ".ai/work-items/archive/2026/governance-performance-budget.outcome.md",
      ".ai/cockpit/task_report.json",
      ".ai/cockpit/task_report.md"
    ],
    "findings": [],
    "risks": [],
    "warnings": [],
    "limitations": [],
    "nonRiskExplanations": [],
    "forbiddenClaims": [],
    "interventions": [],
    "forcedStops": [],
    "resolutions": [],
    "recurrencePrevention": [],
    "avoidedImpact": [],
    "residualRisks": [],
    "humanDecisions": [],
    "evidence": [
      {
        "source": ".ai/work-items/archive/2026/governance-performance-budget.contract.json",
        "subject": "Contract"
      },
      {
        "source": ".ai/work-items/archive/2026/governance-performance-budget.summary.json",
        "subject": "Summary"
      }
    ]
  }
}
