{
  "format": "ai-cockpit-task-outcome",
  "schemaVersion": 1,
  "workItemId": "foreign-duplicate-start-v1",
  "status": "completed",
  "bindings": {
    "taskId": "foreign-duplicate-start-v1",
    "contractDigest": "2fc9ad4019cb3ca1d25891a6e311702183f653be5235ceea0d49fa7077dff212",
    "summaryDigest": "2271c95dc95917f74a61e64e5d4483c3c29701d9d34f702dc4d5228ffdb15f4a",
    "verificationDigest": "cd97cb70df0937bf6c52d0f875a4d4afdfc7b5a3a7f05945db1b8aee18146d56",
    "baseCommit": "2e09db7068cfb6654afc8e545927df2e8bc1f825",
    "headCommit": "2e09db7068cfb6654afc8e545927df2e8bc1f825",
    "lifecycleStage": "pre_merge",
    "pullRequest": {
      "state": "not_created"
    },
    "aiCockpitVersion": "repository-governance",
    "generatorVersion": "1.0"
  },
  "sections": {
    "outcomeSummary": "Task foreign-duplicate-start-v1 generated an evidence-derived outcome with status completed.",
    "taskOverview": "Governed Work Item: foreign-duplicate-start-v1",
    "deliveredChanges": [
      ".ai/work-items/archive/2026/foreign-duplicate-start-v1.contract.json",
      ".ai/work-items/archive/2026/foreign-duplicate-start-v1.summary.json",
      ".ai/work-items/starts/foreign-duplicate-start-v1.json",
      ".ai/cockpit/current_status.md",
      ".ai/evidence/test-weakening/foreign-duplicate-start-v1.json",
      "scripts/ai_start.py",
      "tests/test_start_and_archive.py",
      "docs/reference/capability-truth-matrix.json",
      "docs/reference/japanese-capability-assessment.json",
      "docs/reference/japanese-capability-assessment.md",
      "docs/reference/pre-release-documentation-alignment.json",
      "docs/reference/pre-release-documentation-alignment.md",
      ".ai/work-items/archive/2026/foreign-duplicate-start-v1.outcome.json",
      ".ai/work-items/archive/2026/foreign-duplicate-start-v1.outcome.md"
    ],
    "findings": [],
    "risks": [],
    "warnings": [],
    "limitations": [],
    "nonRiskExplanations": [],
    "forbiddenClaims": [],
    "interventions": [],
    "forcedStops": [],
    "resolutions": [],
    "recurrencePrevention": [],
    "avoidedImpact": [],
    "residualRisks": [],
    "humanDecisions": [],
    "evidence": [
      {
        "source": ".ai/work-items/archive/2026/foreign-duplicate-start-v1.contract.json",
        "subject": "Contract"
      },
      {
        "source": ".ai/work-items/archive/2026/foreign-duplicate-start-v1.summary.json",
        "subject": "Summary"
      }
    ]
  }
}
