{
  "format": "ai-cockpit-task-outcome",
  "schemaVersion": 1,
  "workItemId": "permit-quarantined-successor-start-737-current-main",
  "status": "completed",
  "bindings": {
    "taskId": "permit-quarantined-successor-start-737-current-main",
    "contractDigest": "6ed708f3cbf478a8b7593c31b28ebc99cb8bfe234c45c56144575a0569525edd",
    "summaryDigest": "a13c62a9015b7fa168d0c5f3859cc5e0c0800c575b92cfa05812954ffe1e29bb",
    "verificationDigest": "b80d93ceb1038cc14e4798cc7e57a8c580e420953e591d85ca88d76f784af9f0",
    "baseCommit": "2308627944e1867a1abb63f8bdc68befbe9d4b99",
    "headCommit": "2308627944e1867a1abb63f8bdc68befbe9d4b99",
    "lifecycleStage": "pre_merge",
    "pullRequest": {
      "state": "not_created"
    },
    "aiCockpitVersion": "repository-governance",
    "generatorVersion": "1.0"
  },
  "sections": {
    "outcomeSummary": "Task permit-quarantined-successor-start-737-current-main generated an evidence-derived outcome with status completed.",
    "taskOverview": "Governed Work Item: permit-quarantined-successor-start-737-current-main",
    "deliveredChanges": [
      ".ai/work-items/archive/2026/permit-quarantined-successor-start-737-current-main.contract.json",
      ".ai/work-items/archive/2026/permit-quarantined-successor-start-737-current-main.summary.json",
      ".ai/work-items/starts/permit-quarantined-successor-start-737-current-main.json",
      "scripts/ai_start.py",
      "tests/test_start_and_archive.py",
      "docs/reference/ai-cockpit-work-item-lifecycle.md",
      "docs/reference/capability-truth-matrix.json",
      "docs/reference/pre-release-documentation-alignment.json",
      "docs/reference/pre-release-documentation-alignment.md",
      ".ai/work-items/archive/2026/permit-quarantined-successor-start-737-current-main.outcome.json",
      ".ai/work-items/archive/2026/permit-quarantined-successor-start-737-current-main.outcome.md"
    ],
    "findings": [],
    "risks": [],
    "warnings": [],
    "limitations": [],
    "nonRiskExplanations": [],
    "forbiddenClaims": [],
    "interventions": [],
    "forcedStops": [],
    "resolutions": [],
    "recurrencePrevention": [],
    "avoidedImpact": [],
    "residualRisks": [],
    "humanDecisions": [
      "授权给你"
    ],
    "evidence": [
      {
        "source": ".ai/work-items/archive/2026/permit-quarantined-successor-start-737-current-main.contract.json",
        "subject": "Contract"
      },
      {
        "source": ".ai/work-items/archive/2026/permit-quarantined-successor-start-737-current-main.summary.json",
        "subject": "Summary"
      }
    ]
  }
}
