{
  "format": "ai-cockpit-task-outcome",
  "schemaVersion": 1,
  "workItemId": "final-v0548-audit",
  "status": "completed",
  "bindings": {
    "taskId": "final-v0548-audit",
    "contractDigest": "d5e1406f5f7b6127bed43e91ef00e3877e92b7cbb36558d27e144dc18ef49a5d",
    "summaryDigest": "fb7ee1e9140f4f91c32ead30bb2b3097d708a54e94c80e95501964b449d2d98f",
    "verificationDigest": "a7fb0d11a05139df00a7cb862b99177b18fa552b5106e1faf617aa585d8fd5b4",
    "baseCommit": "3493d6e9e0f2a41a82b7779e839d6594f3132d1a",
    "headCommit": "3493d6e9e0f2a41a82b7779e839d6594f3132d1a",
    "lifecycleStage": "pre_merge",
    "pullRequest": {
      "state": "not_created"
    },
    "aiCockpitVersion": "repository-governance",
    "generatorVersion": "1.0"
  },
  "sections": {
    "outcomeSummary": "Task final-v0548-audit generated an evidence-derived outcome with status completed.",
    "taskOverview": "Governed Work Item: final-v0548-audit",
    "deliveredChanges": [
      ".ai/work-items/archive/2026/final-v0548-audit.contract.json",
      ".ai/work-items/archive/2026/final-v0548-audit.summary.json"
    ],
    "findings": [],
    "risks": [],
    "warnings": [],
    "limitations": [],
    "nonRiskExplanations": [],
    "forbiddenClaims": [],
    "interventions": [],
    "forcedStops": [],
    "resolutions": [],
    "recurrencePrevention": [],
    "avoidedImpact": [],
    "residualRisks": [],
    "humanDecisions": [],
    "evidence": [
      {
        "source": ".ai/work-items/archive/2026/final-v0548-audit.contract.json",
        "subject": "Contract"
      },
      {
        "source": ".ai/work-items/archive/2026/final-v0548-audit.summary.json",
        "subject": "Summary"
      }
    ]
  }
}
