{
  "format": "ai-cockpit-task-outcome",
  "schemaVersion": 1,
  "workItemId": "verification-impact-dag-routing",
  "status": "completed",
  "bindings": {
    "taskId": "verification-impact-dag-routing",
    "contractDigest": "e7b757e6c51b72e84a5e14f37d437cd11849cef9a070b77b94aa0bee972b21e9",
    "summaryDigest": "34f1f3ad069f45672cfede7c6310c790bb51997175bf43580a293170c88f5956",
    "verificationDigest": "32c4efdab29f20310b9b3a55f874329f2766870adfc35e07328b808e8dc36df8",
    "baseCommit": "9155454852441d15ed339bbbd14a89798e658474",
    "headCommit": "9155454852441d15ed339bbbd14a89798e658474",
    "lifecycleStage": "pre_merge",
    "pullRequest": {
      "state": "not_created"
    },
    "aiCockpitVersion": "repository-governance",
    "generatorVersion": "1.0"
  },
  "sections": {
    "outcomeSummary": "Task verification-impact-dag-routing generated an evidence-derived outcome with status completed.",
    "taskOverview": "Governed Work Item: verification-impact-dag-routing",
    "deliveredChanges": [
      ".ai/work-items/archive/2026/verification-impact-dag-routing.contract.json",
      ".ai/work-items/archive/2026/verification-impact-dag-routing.summary.json",
      "scripts/ai_verification_policy.py",
      "scripts/ai_verify.py",
      "Makefile",
      "tests/test_verification_impact_graph.py",
      "tests/test_verification_policy.py",
      "tests/test_lightweight_verification.py",
      "docs/reference/work-item-intelligence-interface.md",
      ".ai/work-items/archive/2026/verification-impact-dag-routing.outcome.json",
      ".ai/work-items/archive/2026/verification-impact-dag-routing.outcome.md",
      ".ai/cockpit/task_report.json",
      ".ai/cockpit/task_report.md",
      "docs/reference/capability-truth-matrix.json",
      "docs/reference/japanese-capability-assessment.json",
      "docs/reference/japanese-capability-assessment.md",
      "docs/reference/pre-release-documentation-alignment.json",
      "docs/reference/pre-release-documentation-alignment.md"
    ],
    "findings": [],
    "risks": [],
    "warnings": [],
    "limitations": [],
    "nonRiskExplanations": [],
    "forbiddenClaims": [],
    "interventions": [],
    "forcedStops": [],
    "resolutions": [],
    "recurrencePrevention": [],
    "avoidedImpact": [],
    "residualRisks": [],
    "humanDecisions": [],
    "evidence": [
      {
        "source": ".ai/work-items/archive/2026/verification-impact-dag-routing.contract.json",
        "subject": "Contract"
      },
      {
        "source": ".ai/work-items/archive/2026/verification-impact-dag-routing.summary.json",
        "subject": "Summary"
      }
    ]
  }
}
