{
  "format": "ai-cockpit-task-outcome",
  "schemaVersion": 1,
  "workItemId": "japanese-capability-convergence-679",
  "status": "completed",
  "bindings": {
    "taskId": "japanese-capability-convergence-679",
    "contractDigest": "712f7c042e3bb51660f7f0f832cd8e733a344c704401929aa5b071815a9e76e6",
    "summaryDigest": "3210ec91bbf86c307c13458d50590730a58cd8e7728415019d7eff69ebfbdbde",
    "verificationDigest": "8eb035587d12160595c52ef9dc0e17b1e125cfb2115a9c0c36e352d9956b7b13",
    "baseCommit": "a2c30dce855d97ee6ca5bdc1e63ac26fb337e289",
    "headCommit": "a2c30dce855d97ee6ca5bdc1e63ac26fb337e289",
    "lifecycleStage": "pre_merge",
    "pullRequest": {
      "state": "not_created"
    },
    "aiCockpitVersion": "repository-governance",
    "generatorVersion": "1.0"
  },
  "sections": {
    "outcomeSummary": "Task japanese-capability-convergence-679 generated an evidence-derived outcome with status completed.",
    "taskOverview": "Governed Work Item: japanese-capability-convergence-679",
    "deliveredChanges": [
      ".ai/work-items/archive/2026/japanese-capability-convergence-679.contract.json",
      ".ai/work-items/archive/2026/japanese-capability-convergence-679.summary.json",
      ".ai/work-items/starts/japanese-capability-convergence-679.json",
      ".ai/cockpit/current_status.md",
      "scripts/ai_japanese_capability.py",
      "tests/test_japanese_capability.py",
      "tests/test_pre_release_documentation_alignment.py",
      "docs/reference/capability-truth-matrix.json",
      "docs/reference/japanese-capability-assessment.json",
      "docs/reference/japanese-capability-assessment.md",
      "docs/reference/pre-release-documentation-alignment.json",
      "docs/reference/pre-release-documentation-alignment.md"
    ],
    "findings": [],
    "risks": [],
    "warnings": [],
    "limitations": [],
    "nonRiskExplanations": [],
    "forbiddenClaims": [],
    "interventions": [],
    "forcedStops": [],
    "resolutions": [],
    "recurrencePrevention": [],
    "avoidedImpact": [],
    "residualRisks": [],
    "humanDecisions": [],
    "evidence": [
      {
        "source": ".ai/work-items/archive/2026/japanese-capability-convergence-679.contract.json",
        "subject": "Contract"
      },
      {
        "source": ".ai/work-items/archive/2026/japanese-capability-convergence-679.summary.json",
        "subject": "Summary"
      }
    ]
  }
}
